{
  "schema_version": "1.0",
  "url": "https://www.flipkart.com/ai-nova-2-5g-black-64-gb/p/itme6e69f9ec9956?pid=MOBHKHPYYA5KZSYP",
  "site": "flipkart.com",
  "missing": ["price", "rating", "availability", "delivery", "seller", "specs"],
  "text": "Ai+ Nova 2 5G (Black, 64 GB) (4 GB RAM)\n/\nNova 2 5G (Black, 64 GB)\nKey Highlights\n+14\nSelected Color:\nBlack\nVariant:\n64 GB + 4 GB\n128 GB + 4 GB\n↓20%\n17,499\n₹13,999\n128 GB + 6 GB\n₹14,999\n64 GB + 4 GB\n↓7%\n13,999\n₹12,999\nAi+ Nova 2 5G (Black, 64 GB) (4 GB RAM)\n4.2\n| 7,285\nTop Discount of the Sale\n7%\n13,999\n₹12,999\n+₹129 Protect Promise Fee\nBuy at ₹11,999\nApply offers for maximum savings\n₹11,999\nLowest price for you\nOR\n₹4,107 x 3m\nPay ₹12,320\nExchange offer\nNot available at this Pincode\nUp to ₹9,800\nChange pincode to exchange item\nExchange offer\nUp to ₹9,800\nBank offers\n₹1,000 off\nView EMI offers\nAdditional benefits on this purchase\nUnlock Ai+ coupon • ₹1000 off\nUnlock Chargers coupon • 10% off\nUnlock Printers coupon • 10% off\nUnlock Storage Devices coupon • 10% off\nUnlock Air fryer coupon • 10% off\nDelivery details\nLocation not set\nSelect delivery location\nDelivery by\nWednesday, 14 Oct\nSeller: IndiFlashMart\nSee other sellers\n4.5\n•\n10 years with Flipkart\nShop with peace of mind\n1 Year Warranty on Handset and 6 Months Warranty on the Inbox Accessories\n7-day brand support\nCash on Delivery\nFlipkart Assured\nProduct highlights\n4 GB RAM | 64 GB ROM\nT8200 | Octa Core Processor | 2.3 GHz Clock Speed\n50MP Rear Camera\n8MP Front Camera\n6.745 inch\n6000 mAh Battery\nAll details\nShowcase\nSpecifications\nWarranty\nManufacturer info\nShow More\nBuy with EMI\nFrom ₹4,449/m\nBuy now\na\nt\n₹\n0\n1\n2\n3\n4\n5\n6\n7\n8\n9\n0\n1\n2\n3\n4\n5\n6\n7\n8\n9\n,\n0\n1\n2\n3\n4\n5\n6\n7\n8\n9\n0\n1\n2\n3\n4\n5\n6\n7\n8\n9\n0\n1\n2\n3\n4\n5\n6\n7\n8\n9\nHang on, loading content\nMore about Ai+ Nova 2 5G (Black, 64 GB)+\nMore about Ai+ Nova 2 5G (Black, 64 GB)\n+\nTop Stories :Brand Directory\nnull Mobiles & Accessories:IPHONE 6 128GB PRICE IN INDIAINTEX XTREMELAVA IRIS X8 SPECIFICATIONMI3 MOBILEMICROMAX XLIPHONE PRICEHTC MOBILES IN INDIAINTEX MOBILE PHONE PRICEMOTO G MOBILESONY XPERIA PHONE PRICENEXUS 4 PRICE IN INDIAASUS TABLETSSAMSUNG GALAXY DUOSSAMSUNG PRIMOXPERIA C3SONY XPERIA M4 AQUA PRICESAMSUNG GALAXY K ZOOM PRICE IN INDIAASUS ZENFONE 4 SELFIE PROASUS ZENFONE SELFIEHTC 620HTC DESIRE 820SLENOVO P780DELL MOBILEHONOR MOBILE PRICE IN INDIAANDROID PHONES UNDER 20000NOKIA X2 PRICEOPPO F3 PLUSSAMSUNG S7582XPERIA Z2 PRICE IN INDIAVIVO X5 MAX\nnull Mobiles & Accessories:\nnull Mobiles & Accessories: IPHONE 6 128GB PRICE IN INDIAINTEX XTREMELAVA IRIS X8 SPECIFICATIONMI3 MOBILEMICROMAX XLIPHONE PRICEHTC MOBILES IN INDIAINTEX MOBILE PHONE PRICEMOTO G MOBILESONY XPERIA PHONE PRICENEXUS 4 PRICE IN INDIAASUS TABLETSSAMSUNG GALAXY DUOSSAMSUNG PRIMOXPERIA C3SONY XPERIA M4 AQUA PRICESAMSUNG GALAXY K ZOOM PRICE IN INDIAASUS ZENFONE 4 SELFIE PROASUS ZENFONE SELFIEHTC 620HTC DESIRE 820SLENOVO P780DELL MOBILEHONOR MOBILE PRICE IN INDIAANDROID PHONES UNDER 20000NOKIA X2 PRICEOPPO F3 PLUSSAMSUNG S7582XPERIA Z2 PRICE IN INDIAVIVO X5 MAX\nnull Mobiles & Accessories:",
  "truncated": false
}
