{
  "schema_version": "1.0",
  "url": "https://www.flipkart.com/ai-nova-2-5g/p/itm123",
  "site": "flipkart.com",
  "missing": ["specs", "delivery.cost", "category"],
  "text": "Ai+ Nova 2 5G (Black, 64 GB) (4 GB RAM)\n4.2 ★ 7,285 Ratings & 612 Reviews\n₹12,999 ₹13,999 7% off\nFree delivery by Wednesday, 14 Oct\nSeller IndiFlashMart\nBattery Capacity 6000 mAh\nDisplay Size 17.13 cm (6.745 inch)\nProcessor Type T8200\nExpandable Storage 1 TB",
  "truncated": false
}
