{
  "schema_version": "1.0",
  "url": "https://www.amazon.in/dp/B0C3ZYFZ77",
  "site": "amazon.in",
  "missing": ["price", "rating", "availability", "delivery", "seller", "specs"],
  "text": "boAt Airdopes Joy, 35Hrs Battery, Fast Charge, IWP Tech, Low Latency, 2Mic ENx, Type-C Port, v5.3 Bluetooth Earbuds, TWS Ear Buds Wireless Earphones with mic(Jet Black)\nSponsored\nElectronics\nHeadphones, Earbuds & Accessories\nHeadphones\nIn-Ear\nEnjoy Unlimited FREE Same day/1-day delivery, Prime offers everyday and more\nJoin Prime >>\n₹798.00\nFREE delivery Monday, 12 October. Details\nMonday, 12 October\nOr fastest delivery Tomorrow 8 am - 12 pm. Order within 6 hrs 45 mins. Details\nTomorrow 8 am - 12 pm\n8 am - 12 pm\n6 hrs 45 mins\nIn stock\nShips from\nAmazon\nSold by\nClicktech Retail Private Ltd\nSee more\nAdd a Protection Plan:\n1 Year Extended Warranty by OneAssist for ₹79.00\n₹79.00\nExtended Warranty for ₹71.00\n₹71.00\n1 Year Extended warranty by Acko for ₹99.00\n₹99.00\n2 Years Extended Warranty Plan by OneAssist for ₹149.00\n₹149.00\nAdd to Wish List\nOther sellers on Amazon\nNew (3) from ₹798.00 Fulfilled FREE Delivery.\nNew (3) from\n₹798.00\nFulfilled FREE Delivery.\nFulfilled\n5 VIDEOS\nboAt Airdopes Joy, 35Hrs Battery, Fast Charge, IWP Tech, Low Latency, 2Mic ENx, Type-C Port, v5.3 Bluetooth Earbuds, TWS Ear Buds Wireless Earphones with mic(Jet Black)\nVisit the boAt Store\n3.7 out of 5 stars (11,058)\n3.7 out of 5 stars\n(11,058)\n5K+ bought in past month\n5K+ bought\nin past month\n₹798.00 with 77 percent savings\nM.R.P.: ₹3,490.00\nInclusive of all taxes\nOffers\nPrevious page\nUpto ₹23.00 cashback as Amazon Pay Balance when you pay with Amazon Pay ICICI Bank Credit Cards\nUpto ₹3,000.00 discount on SBI Credit Cards, SBI Debit Cards\nGet GST invoice and save up to 18% on business purchases. Sign up for free\nNext page\nPrevious page\n10 days Service Centre Replacement\nFree Delivery\n1 Year Warranty\nPay on Delivery\nTop Brand\nAmazon Delivered\nSecure transaction\nNext page\nColour: Jet Black\nColour:\nJet Black\nSee 0 options with no featured offers\nBrand boAt\nBrand\nboAt\nColour Jet Black\nColour\nJet Black\nEar Placement In Ear\nEar Placement\nIn Ear\nForm Factor In Ear\nForm Factor\nIn Ear\nImpedance 100 Ohms\nImpedance\n100 Ohms\nAbout this item\nLow Latency BEAST Mode: Experience lag-free high-quality gaming with low latency of up to 50 ms. Visuals align with impactful audio for realistic action.\nExtensive Playtime: Up to 35 hours of performance gives you plenty of time to listen to your preferred tunes. As for OTT, you can tick off your watchlist with Airdopes Alpha as your audio companion.\nboAt Signature Sound: Powered by dual 13 mm drivers, these earbuds deliver matchless boAt Signature sound with superior bass.\nENx Tech with Dual Mics: To offer unparalleled sound clarity, the dual mics of these earbuds are enhanced with ENxTM tech that wards off background noise. Engage in online discussions easily regardless of your location as your voice is heard without distortion.\nASAP Charging: 10 minutes of charging yields about 120 minutes of seamless performance. Revel in music to your heart’s content in no time at all!\nIPX5 Resistance: You can attend outdoor events while wearing these earbuds as they sport an IPX5-rated build. So, water splashes from pools, drizzles, or sweat won’t hamper your enjoyment.\nRapid Connectivity: When the case lid opens, IWP technology facilitates instant device connection, while Bluetooth v5.3 maintains a stable link up to 10 m, ensuring that you are always connected.\n› See more product details\n›\nReport an issue with this product\nCheck Compatibility\nChoose your product\nCellular Phone\nTablet Computer\nWearable Computer\nSign in/Create a free business account\nFrequently bought together\nThis item: boAt Airdopes Joy, 35Hrs Battery, Fast Charge, IWP Tech, Low Latency, 2Mic ENx, Type-C Port, v5.3 Bluetooth Earbuds, TWS Ear Buds Wireless Earphones with mic(Jet Black)\nThis item:\nboAt Airdopes Joy, 35Hrs Battery, Fast Charge, IWP Tech, Low Latency, 2Mic ENx, Type-C Port, v5.3 Bluetooth Earbuds, TWS Ear Buds Wireless Earphones with mic(Jet Black)\n₹798.00\nGet it by Monday, October 12\nIn stock\nSold by Clicktech Retail Private Ltd and ships from Amazon Fulfillment.\n+\nSounce Premium Silicone Case Cover Compatible with Boat Airdopes Joy v2 Durable Shockproof & Scratch Resistant Protective Skin, Anti-Slip Grip, Dustproof Lightweight with Front LED Visibility (Black)\n₹189.00\nGet it by Monday, October 12\nIn stock\nSold by Clicktech Retail Private Ltd and ships from Amazon Fulfillment.\nTotal price: $00\nTotal price:\n$00\nTo see our price, add these items to your cart.\nChoose items to buy together.\nCustomers who viewed this item also viewed\nPage 1 of 1 Start over\nPage 1 of 1\n1\nStart over\nPrevious set of slides\nboAt 2026 Launch Airdopes Joy v2, 35H Battery, Pocketable Design, ASAP™ Charge, 13mm Drivers, Easy Touch Controls, ENx™ Tech, IWP™ & App Support TWS Bluetooth Earbuds with mic (Eclipse Black)\n-77%₹799.00\n-77%\n₹799.00\nGreat Indian Festival\nM.R.P: ₹3,490.00\nM.R.P:\n₹3,490.00\nGet it by Monday, October 12\nFREE Delivery by Amazon\nboAt Airdopes 219, 4Mics ENx, 40H Battery, Best in Segment for Calling, App Support, Bluetooth Earbuds, TWS Ear Buds Wireless Earphones with mic (Carbon Black)\n-78%₹879.00\n-78%\n₹879.00\nM.R.P: ₹3,990.00\nM.R.P:\n₹3,990.00\nGet it by Thursday, October 15\nFREE Delivery by Amazon\nboAt Airdopes 141 Gen 2, 4 Mics ENx Tech, 48 Hrs Playback, Fast Charge, Low Latency, IPX4, v5.4 Bluetooth Earbuds, TWS Ear Buds Wireless Earphones with mic (Active Black)\n-80%₹799.00\n-80%\n₹799.00\nGreat Indian Festival\nM.R.P: ₹3,990.00\nM.R.P:\n₹3,990.00\nGet it by Monday, October 12\nFREE Delivery by Amazon\nboAt Airdopes 101v2, 35H Battery, ENx Tech, 13mm Drivers, ASAP Charge, Flex-Fit Ear Tips,Stream Ad Free Music via App Support, Bluetooth Earbuds, TWS Ear Buds Wireless Earphones with mic (Pitch Black)\n-80%₹799.00\n-80%\n₹799.00\nM.R.P: ₹3,990.00\nM.R.P:\n₹3,990.00\nGet it by Monday, October 12\nFREE Delivery by Amazon\nboAt Airdopes 213, 50H Battery, ENx Tech, Beast Mode, ASAP Charge, Bluetooth Earbuds, TWS Ear Buds Wireless Earphones with mic (Shadow Black)\n-70%₹999.00\n-70%\n₹999.00\nM.R.P: ₹3,290.00\nM.R.P:\n₹3,290.00\nGet it by Friday, October 16\nFREE Delivery by Amazon\nboAt Airdopes 131 with 60 Hrs Playback, ASAP Charge Truly Wireless Bluetooth in Ear Earbuds with Mic (Active Black)\n-73%₹799.00\n-73%\n₹799.00\nGreat Indian Festival\nM.R.P: ₹2,990.00\nM.R.P:\n₹2,990.00\nGet it by Monday, October 12\nFREE Delivery by Amazon\nNext set of slides\nTop Brand\nboAt\n85% positive ratings from 100K+ customers\n100K+ recent orders from this brand\n11+ years on Amazon\nProduct information\nItem details\nDesign\nControls\nBattery\nFeedback\nWould you like to tell us about a lower price?\nAudio\nAdditional details\nConnectivity\nStyle\nMeasurements\nProduct description\nGroove to your favorite songs for hours on end, flaunting the boAt Airdopes Alpha Earbuds. boAt’s IWPTM tech speeds up pairing so there’s no time lost for your entertainment. The large 13 mm dual drivers pump out high-octane boAt Signature sound making these earbuds truly an alpha. Long rides are no longer tedious when you can catch up on podcasts or new OTT releases, courtesy of the immense playback time of up to 35 hours. Additionally, ASAPTM charge ensures that the fun never stops with up to 120 minutes of playtime when charged for merely 10 minutes. Moreover, BEASTTM mode eliminates lag with 50 ms low latency infusing a dose of adrenaline into your gaming sessions. With dynamic sound in sync, visuals feel realistic. These earbuds also boast IPX5 resistance that keeps sweat and water splashes at bay for hassle-free workouts at the gym. A simple tap enables the voice assistant to follow a plethora of commands ranging from calling your loved ones to creating your shopping list. Complete your tasks on the go, with the alpha of true wireless sound at your fingertips.",
  "truncated": false
}
